{
  "schema": "gamebuddy-action-work-brief/v1",
  "gameId": "stardew",
  "actionId": "equip_tool",
  "baseCommit": "0000000000000000000000000000000000000000",
  "contractVersion": 1,
  "status": "frozen",
  "effect": "mutation",
  "claimScope": "Static development brief only: it validates the package-local descriptor mechanics for equip_tool and grants no runtime, catalog, fixture, bridge, or live-mutation capability.",
  "ownedPaths": [
    "integrations/stardew/action-development/standalone/briefs/equip_tool.static.json",
    "integrations/stardew/action-development/standalone/descriptors/equip_tool.static.json",
    "integrations/stardew/action-development/standalone/tests/equip_tool-static.test.mjs"
  ],
  "sharedHubs": [],
  "requiredPortfolioEntries": [],
  "liveAuthorized": false,
  "checks": [
    "pnpm --dir integrations/stardew/action-development test"
  ]
}
